{
  "name": "webflow-agent-skills",
  "description": "Ship solutions for and with Webflow. This plugin provides a collection of skills to help you integrate and automate tasks related to Webflow, including webhook management, designer api tasks, and more.",
  "version": "2.0.0",
  "author": {
    "name": "224 Industries",
    "email": "support@224industries.com.au"
  },
  "homepage": "https://224industries.com.au",
  "repository": "https://github.com/224-industries/webflow-skills",
  "license": "MIT",
  "keywords": [
    "ai",
    "agent",
    "skill",
    "webflow"
  ],
  "skills": "./skills/",
  "logo": "assets/webflow-logomark.svg"
}
